id,latitude,longitude,name,type,color
2923,40.759594,-73.936974,CHN-Long Island City Health Center,DTC-EC,7E7D72
2924,41.101517,-72.363373,Community Health,DTC-EC,7E7D72
2925,42.124142,-77.949333,Jones Memorial Medical Practice,HOSP-EC,C30B95
2926,42.996834,-74.362953,FonClair Terrace Primary Care Center,HOSP-EC,C30B95
2927,40.583855,-73.946373,Greater New York Endoscopy Surgical Center,DTC,F18FFD
2928,43.099197,-79.05085,Northpointe Council Methadone Maintenance Treatment Program,DTC,F18FFD
2929,40.879955,-73.400848,"Long Island Hand and Orthopedic Surgery Center, LLC",DTC,F18FFD
2930,40.812447,-73.252403,GSHMC-Central Regional Laboratory Services,HOSP-EC,C30B95
2931,41.197136,-73.966293,Haverstraw Health Center,DTC-EC,7E7D72
2932,42.527901,-75.525398,Norwich Primary Care Center,HOSP-EC,C30B95
2933,44.663239,-74.966331,Canton Family Health Center,HOSP-EC,C30B95
2934,43.058708,-76.135658,St. Joseph's Dialysis - Regional,DTC,F18FFD
2935,43.041546,-76.261375,St. Joseph's Dialysis - Camillus,DTC-EC,7E7D72
2936,42.60004,-76.203362,St. Joseph's Dialysis - Cortland,DTC-EC,7E7D72
2937,43.040108,-76.022133,St. Joseph's Dialysis - Northeast,DTC-EC,7E7D72
2938,43.168682,-76.240944,St. Joseph's Dialysis - Seneca,DTC-EC,7E7D72
2939,43.256245,-77.065659,Myers Medical Office Building,HOSP-EC,C30B95
2940,40.753578,-73.860298,Urban Health Plan Extension Clinic,DTC-EC,7E7D72
2941,40.801136,-73.946198,Catholic Managed Long Term Care,DTC,F18FFD
2942,40.951462,-73.816711,Lawrence Hospital Center for PT & Sport Medicine,HOSP-EC,C30B95
2943,40.968609,-73.88269,Yonkers East Dialysis Center,DTC-EC,7E7D72
2944,43.059635,-77.100792,Wayne Medical Group - Orthopedics,HOSP-EC,C30B95
2945,43.059616,-77.100792,Urology Practice Wayne Medical Group,HOSP-EC,C30B95
2946,43.113632,-77.607651,URMC Ambulatory Center,HOSP-EC,C30B95
2947,43.099155,-76.098633,Crouse Hospital - Commonwealth Division,HOSP,FACB1E
2948,43.0938,-75.275299,Cooperative Magnetic Imaging Center,DTC-EC,7E7D72
2949,43.083561,-75.267189,Cooperative Magnetic Imaging Center,DTC-EC,7E7D72
2950,42.480274,-76.463425,Cayuga Medical Center Physical Therapy,HOSP-EC,C30B95
2951,40.697464,-73.585617,NUMC Dialysis Center @ A. Holly Patterson Extended Care Facility,HOSP-EC,C30B95
2952,40.696907,-73.897957,CenterLight Healthcare D&TC,DTC-EC,7E7D72
2953,40.703995,-73.919441,Wyckoff Heights Medical Center Extension Clinic,HOSP-EC,C30B95
2954,40.702305,-73.415138,Long Island Renal Care,DTC-EC,7E7D72
2955,41.435596,-74.041466,Cornwall Radiation Oncology Services,DTC,F18FFD
2956,40.764553,-73.960243,Memorial Sloan Kettering Breast and Diagnostic Imaging Center,HOSP-EC,C30B95
2957,40.633774,-74.011429,Maimonides Cancer Center,HOSP-EC,C30B95
2958,42.246239,-73.776306,Columbia Memorial Mobile Dental Services,,B0A150
2959,40.69632,-73.291725,"Island Endoscopy Center, LLC",DTC,F18FFD
2960,40.711117,-73.786682,Jamaica Assessment Center,HOSP-EC,C30B95
2961,40.66888,-73.756805,Springfield Gardens Educational Campus,HOSP-SB,D289EE
2962,42.093357,-76.796593,Chemung County Health Department School Dental Mobile Equipment,,B0A150
2963,43.047588,-76.094757,HW Smith Elementary School,,B0A150
2964,42.746944,-73.758889,Seton Health OB/GYN - Latham,HOSP-EC,C30B95
2965,43.126083,-77.516708,Rochester General Medical Group,HOSP-EC,C30B95
2966,43.859173,-76.006172,Maynard Wilson Elementary School,,B0A150
2967,40.887821,-73.852516,Albert Tuitt Educational Academy,,B0A150
2968,43.091747,-76.059219,Upstate Orthopedics Ambulatory Surgery Center,DTC,F18FFD
2969,40.746284,-73.971489,Ambulatory Surgery Center,HOSP-EC,C30B95
2970,40.819115,-73.900787,NYCHP Primary Care Clinic,HOSP-EC,C30B95
2971,42.45816,-75.049644,Northern Catskill Urology,HOSP-EC,C30B95
2972,43.17028,-77.610596,Jordan Health Link,DTC-EC,7E7D72
2973,44.706108,-73.493805,CVPH Medical Center Rehabilitation Services,HOSP-EC,C30B95
2974,43.112175,-77.597466,Highland Diabetes Health Source (DHS) and Nutrition Edge (NE),HOSP-EC,C30B95
2975,43.123504,-77.319291,Gananda Family Practice,HOSP-EC,C30B95
2976,42.640705,-74.964289,Hartwick Seminary Specialty Services,HOSP-EC,C30B95
2977,41.19828,-73.724709,Open Door Family Medical Center Mobile Van Extension Clinic,,B0A150
2978,40.925381,-73.897026,Cedar Place School,HOSP-SB,D289EE
2979,42.410805,-74.620636,Stamford Central School,HOSP-SB,D289EE
2980,42.549488,-74.818512,Schenevus Central School,HOSP-SB,D289EE
2981,42.591103,-74.95034,Milford Central School,HOSP-SB,D289EE
2982,40.739609,-73.976669,PS 811 M,HOSP-SB,D289EE
2983,40.738209,-73.981506,PS 347,HOSP-SB,D289EE
2984,40.758892,-73.699997,NSUH Comprehensive Wound Care Center and Vascular Access Program,HOSP-EC,C30B95
2985,43.065098,-77.028557,Wayne / Rushville Dental Clinic,DTC-EC,7E7D72
2986,40.814762,-73.914604,Medalliance Medical Health Services Extension Clinic,DTC-EC,7E7D72
2987,40.737343,-73.981209,East Side Endoscopy,DTC,F18FFD
2988,40.630291,-73.966354,NEOMY Dialysis Center,DTC,F18FFD
2989,40.607971,-73.980148,South Brooklyn Endoscopy Center,DTC,F18FFD
2990,41.450043,-74.357803,Crystal Run Ambulatory Surgery Center of Middletown,DTC,F18FFD
2991,41.02351,-73.722519,New York Endoscopy Center,DTC,F18FFD
2992,43.091747,-76.059219,Upstate Campus East,HOSP-EC,C30B95
2993,44.054939,-75.831085,Samaritan Family Practice at LeRay,HOSP-EC,C30B95
2994,40.735512,-73.637985,Sleep Disorders Center at Winthrop University Hospital,HOSP-EC,C30B95
2995,43.1963426,-77.7988738,Unity Hospital Dialysis at Spencerport,HOSP-EC,C30B95
2996,42.306217,-75.3853,Sidney Elementary School,HOSP-SB,D289EE
2997,40.729031,-73.85862,NYU Hospitals Center Columbus Imaging and Infusion Center,HOSP-EC,C30B95
2998,43.112251,-77.616165,FMS-Monroe Community,DTC-EC,7E7D72
2999,42.87542,-77.288475,Thompson Health Sleep Disorder Center,HOSP-EC,C30B95
3000,43.978313,-75.610268,CAH Medical Building,,B0A150
3001,40.705002,-73.637421,Women's Wellness OB/GYN,HOSP-EC,C30B95
3002,40.645657,-74.020584,Sunset Park Familly Health Center,HOSP-EC,C30B95
3003,44.267208,-73.980583,Adirondack Medical Center - Mobile Dental Van,,B0A150
3004,42.147995,-76.021034,Good Shepherd Village at Endwell,NH,A887B8
3005,41.758102,-74.061455,Woodland Pond at New Paltz,NH,A887B8
3006,42.594925,-76.175476,Randall Elementary School,,B0A150
3007,42.604042,-76.188545,Parker Elementary School,,B0A150
3008,40.752899,-73.969398,Midtown Surgery Center,DTC,F18FFD
3009,42.329063,-75.96769,Lourdes Primary Medical Care at Whitney Point,HOSP-EC,C30B95
3010,43.045662,-76.137688,UHCC - Madison Irving,HOSP-EC,C30B95
3011,43.100786,-76.055984,Crouse Physical Rehabilitation,HOSP-EC,C30B95
3012,42.114639,-75.959229,Wilson Place Ambulatory Surgery Center,HOSP-EC,C30B95
3013,43.043964,-74.847458,Valley Health Services ADHC Little Falls,ADHCP,348D04
3014,43.080158,-75.333626,St. Elizabeth Medical Arts,HOSP-EC,C30B95
3015,40.749851,-73.972107,"SurgiCare of Manhattan, LLC",DTC,F18FFD
3016,41.053707,-74.024643,Advanced Surgery Center,DTC,F18FFD
3017,40.975082,-73.697571,The Rye ASC,DTC,F18FFD
3018,40.753952,-73.706223,Queens-Long Island Renal Institute,DTC,F18FFD
3019,42.9702,-78.153297,United Memorial Medical Center Summit Physical and Occupational Therapy Services,HOSP-EC,C30B95
3020,43.101013,-79.052589,Mount St. Mary's Primary Care Extension Clinic for Complete Senior Care Center,HOSP-EC,C30B95
3021,43.046757,-76.136467,UHCC at Hill Medical,HOSP-EC,C30B95
3022,43.305771,-73.655678,Glens Falls Hospital Broad Street Campus,HOSP-EC,C30B95
3023,40.759846,-73.97403,Sillerman Center for Rehabilitation,HOSP-EC,C30B95
3024,41.012508,-73.674782,Park Avenue School,,B0A150
3025,41.534531,-73.896378,St. Luke's Hospital - Physical Therapy Extension Clinic,HOSP-EC,C30B95
3026,40.672401,-73.970551,New York Methodist Extension Clinic,HOSP-EC,C30B95
3027,40.840237,-73.915535,PS 64 Pura Belpre School,HOSP-SB,D289EE
3028,41.33947,-74.399376,Hudson River Healthcare - Goshen,DTC-EC,7E7D72
3029,42.11581,-79.208824,Warner Place,ADHCP,348D04
3030,43.0858,-78.944298,Buffalo Hearing & Speech Center,DTC-EC,7E7D72
3031,43.113036,-79.048565,Community Health Center of Niagara,DTC-EC,7E7D72
3032,42.755863,-78.131851,North Main Outpatient Center,HOSP-EC,C30B95
3033,40.710003,-73.295525,South Bay Cardiovascular Associates,HOSP-EC,C30B95
3034,42.090729,-79.231102,"WCA Center for Orthopedics, Sports Medicine and Rehabilitation Services",HOSP-EC,C30B95
3035,41.495998,-74.044258,Liberty Hudson Valley Dialysis,DTC,F18FFD
3036,40.681763,-73.59124,Roosevelt/Freeport Family Health Center,DTC-EC,7E7D72
3037,40.729557,-73.211349,North Shore LIJ Imaging at Great South Bay,HOSP-EC,C30B95
3038,40.745678,-73.994385,Mount Sinai Comprehensive Health Program - Downtown,HOSP-EC,C30B95
3039,40.615116,-74.023712,University Hospital of Brooklyn - SUNY Downstate at Bay Ridge,HOSP-EC,C30B95
3040,40.684727,-73.979019,Memorial Sloan Kettering Brooklyn Infusion Center,HOSP-EC,C30B95
3041,44.669666,-74.988846,CPH Primary Care Center,HOSP-EC,C30B95
3042,43.111568,-77.616142,Starlight Pediatric Clinic,DTC-EC,7E7D72
3043,43.210129,-77.699257,Unity at Ridgeway,HOSP-EC,C30B95
3044,41.740738,-74.05793,Hudson River Healthcare,DTC-EC,7E7D72
3045,43.040112,-76.02179,Endoscopy Center of Central New York,DTC,F18FFD
3046,43.269234,-73.582779,Fort Edward - Kingsbury Health Center,DTC-EC,7E7D72
3047,43.116489,-78.917671,Community Health Center of Sanborn,DTC-EC,7E7D72
3048,41.509666,-73.958344,Communication Disorders Clinic,HOSP-EC,C30B95
3049,40.730263,-73.235695,South Shore Surgery Center,DTC,F18FFD
3050,40.827885,-73.665306,The Amsterdam at Harborside,NH,A887B8
3051,44.675617,-74.973701,CPH Lawrence Avenue Medical Campus,HOSP-EC,C30B95
3052,42.085968,-75.916481,Vestal Healthcare - UHS Dialysis - Pennsylvania Ave,DTC-EC,7E7D72
3053,42.086632,-75.915337,Vestal Healthcare - UHS Dialysis - Park Avenue,DTC-EC,7E7D72
3054,41.709538,-74.571747,ODA Primary Health Care Network,DTC-EC,7E7D72
3055,41.177467,-73.751076,NWH @ Chappaqua Crossing,HOSP-EC,C30B95
3056,43.987331,-75.93985,Samaritan Lab & X-Ray Services at Coffeen St.,HOSP-EC,C30B95
3057,40.655552,-74.004845,Sunset Park High School,HOSP-SB,D289EE
3058,40.826546,-73.861229,The Bronx Center for Renal Dialysis,DTC,F18FFD
3059,43.087986,-75.248878,Utica Community Health Center,DTC-EC,7E7D72
3060,42.727592,-77.879791,Livingston Community Health Center for Mt. Morris,DTC-EC,7E7D72
3061,42.65839,-73.838501,Eddy Village Green at Beverwyck,NH,A887B8
3062,40.639481,-73.987579,Borough Park Dialysis,DTC-EC,7E7D72
3063,40.725254,-73.592873,HSS Long Island Outpatient Center,HOSP-EC,C30B95
3064,41.448524,-74.416115,Middletown Community Health Center Mobile Van,,B0A150
3065,41.562111,-73.594284,Putnam Hospital Center O/P Rehab Center @ Pawling,HOSP-EC,C30B95
3066,42.753494,-78.857552,Southtowns Dialysis Center,DTC-EC,7E7D72
3067,44.856785,-74.292053,134 Park Street Extension Clinic,HOSP-EC,C30B95
3068,40.759109,-73.68927,St. Mary's Home Care,CHHA,348588
3069,40.827461,-73.906647,BASICS Mobile Van Extension Clinic,,B0A150
3071,42.868725,-73.8078,Clifton Park Pediatric Center,HOSP-EC,C30B95
3072,42.45723,-75.033241,Bassett Healthcare at Fox Care,HOSP-EC,C30B95
3073,43.103691,-73.579674,Schuylerville Family Health Center,HOSP-EC,C30B95
3074,43.023949,-74.032336,Galway Family Health Center,HOSP-EC,C30B95
3075,43.087566,-73.789116,Saratoga Family Health Center,HOSP-EC,C30B95
3076,42.770695,-73.821442,St. Peter's Hospital Spine & Neurosurgery,HOSP-EC,C30B95
3077,42.089844,-78.42688,Olean General Hospital School-Based Portable Dental Equipment,HOSP-SB,D289EE
3078,44.216591,-74.462013,Tupper Lake Health Center,HOSP-EC,C30B95
3079,42.685863,-73.813545,St. Peter's Breast Center - Washington Avenue Mammography,HOSP-EC,C30B95
3080,43.025738,-74.34584,Primary/Specialty Care Center at Decker Drive,HOSP-EC,C30B95
3081,41.166615,-73.988152,"A & T Certified Home Care, LLC",CHHA,348588
3082,42.345711,-76.849014,Montour Falls Extension Clinic,,B0A150
3083,42.814838,-73.945724,"Ridge Health Services, Inc.",DTC,F18FFD
3084,44.694698,-73.486702,CVPH Open MRI,HOSP-EC,C30B95
3085,40.60194,-73.993904,"Gastroenterology Care, Inc",DTC,F18FFD
3086,43.094048,-79.0504,Niagara Falls Kidney Care Center,DTC-EC,7E7D72
3087,42.1423,-77.054403,AMS Mammography Suite,HOSP-EC,C30B95
3088,40.635269,-74.01062,Brooklyn Hospital Center Extension Clinic,HOSP-EC,C30B95
3089,40.825615,-73.909386,"Bronx Addiction Servcies Integrated Concepts, Inc a/k/a BASICS, Inc",DTC-EC,7E7D72
3090,40.741055,-73.999825,"Center for Comprehensive Care, West Village Division",HOSP-EC,C30B95
3091,40.627888,-73.956863,Millenium Ambulatory Surgery Center,DTC,F18FFD
3092,43.142277,-77.642517,His Branches Inc,DTC,F18FFD
3093,40.971264,-73.742615,Surgical Specialty Center of Westchester,DTC,F18FFD
3094,40.695492,-73.298157,Good Samaritan Hospital Women's imaging Center,HOSP-EC,C30B95
3095,42.305376,-75.395923,UHS Primary Care Sidney,HOSP-EC,C30B95
3096,40.732681,-73.93644,"Smile New York Outreach, LLC Mobile Dental Clinic",,B0A150
3097,40.760899,-73.793915,Rogosin Kidney Center - Auburndale,DTC-EC,7E7D72
3098,43.060204,-78.830307,Niagara Renal Center of Wheatfield,DTC-EC,7E7D72
3099,44.807465,-74.774399,Canton-Potsdam Hospital Brasher Falls Physical Therapy,HOSP-EC,C30B95
3100,40.659435,-73.934036,Kingsbrook Jewish Medical Center Inc. - Rutland Nursing Home,HOSP-EC,C30B95
3102,42.115669,-75.967491,UHS Primary Care Main Street,HOSP-EC,C30B95
3103,42.099567,-76.270615,UHS Primary Care Owego,HOSP-EC,C30B95
3104,42.084583,-76.056671,UHS Dermatology,HOSP-EC,C30B95
3105,42.08654,-75.914001,UHS Medical Group Orthopedics,HOSP-EC,C30B95
3106,43.090382,-75.285759,Mohawk Valley Endoscopy Center,DTC,F18FFD
3107,40.739605,-73.976509,"River Renal Services, Inc",DTC,F18FFD
3108,40.633896,-74.012894,Maimonides Breast Center,HOSP-EC,C30B95
3109,43.0858,-78.944298,"Mount St. Mary's Ear, Nose and Throat Services",HOSP-EC,C30B95
3110,42.098923,-76.04731,UHS Primary Care Endicott,HOSP-EC,C30B95
3111,40.734974,-73.173698,Suffolk Hearing and Speech Center of Good Samaritan Hospital Medical Center,HOSP-EC,C30B95
3112,43.135769,-77.607544,Strong Infusion Center at Highland Hospital,HOSP-EC,C30B95
3113,42.733574,-73.671455,The Burdett Care Center,HOSP,FACB1E
3114,40.782249,-73.716301,NSUH Imaging at Great Neck,HOSP-EC,C30B95
3115,41.037411,-73.7612,Women's Premier Obstetrics,DTC-EC,7E7D72
3116,40.85429,-73.909782,Morris Heights Health Center,DTC-EC,7E7D72
3117,42.08371,-75.916679,UHS Sleep and Neurodiagnostic Center,HOSP-EC,C30B95
3118,42.699154,-73.851128,Dialysis Clinic Inc,DTC-EC,7E7D72
3119,40.69698,-73.955376,ODA Primary Health Care Network,DTC-EC,7E7D72
3120,42.890629,-78.754417,U.S. Renal Care Cheektowaga Dialysis Center,DTC,F18FFD
3121,42.997509,-78.850815,U.S. Renal Care Tonawanda Dialysis,DTC,F18FFD
3122,42.509262,-78.664352,Springville Primary Care Center,HOSP-EC,C30B95
3123,40.736511,-73.981987,NYU Hospitals Center Initiative for Women with Disabilities,HOSP-EC,C30B95
3124,40.73735,-73.979767,NYU Hospitals Center Extension Clinic,HOSP-EC,C30B95
3125,43.209602,-75.413391,Griffiss Surgery Center,DTC,F18FFD
3126,42.095646,-75.969086,UHS Vestal Physical Therapy,HOSP-EC,C30B95
3127,42.159592,-75.895233,UHS Primary Care Upper Front Street,HOSP-EC,C30B95
3128,40.846844,-73.896172,CHN - Tremont,DTC-EC,7E7D72
3129,42.332481,-75.772125,UHS Primary Care - Greene,HOSP-EC,C30B95
3130,42.892193,-78.883812,Neighborhood Health Center Mattina,DTC-EC,7E7D72
3131,40.630824,-73.97037,Shining Star Home Health Care,CHHA,348588
3132,40.814877,-73.905464,Ponce de Leon Elementary School/PS 161,,B0A150
3133,40.876953,-73.912514,John F. Kennedy Education Campus,HOSP-SB,D289EE
3134,40.822781,-73.923477,Mott Haven Campus,HOSP-SB,D289EE
3135,40.754951,-73.979721,"Manhattan Endoscopy Center, LLC",DTC,F18FFD
3136,40.741028,-74.003242,Mount Sinai Downtown Chelsea Center,HOSP-EC,C30B95
3137,42.6329,-75.316498,Unadilla Valley Central School,HOSP-SB,D289EE
3138,40.746037,-73.998009,BIMC Geriatrics Senior Health Center,HOSP-EC,C30B95
3139,40.840389,-73.91098,William Howard Taft High School,HOSP-SB,D289EE
3140,43.15477,-78.66655,ENMG at Elizabeth Drive,HOSP-EC,C30B95
3141,42.98333,-78.697006,U.S. Renal Care Williamsville Dialysis Center,DTC,F18FFD
3142,41.1778814,-74.5933293,The Turning Point Program,HOSP-EC,C30B95
3143,40.817219,-73.897606,Banana Kelly High School,,B0A150
3144,43.988304,-75.644897,Carthage Middle School,,B0A150
3145,41.532356,-73.887177,Fishkill Dialysis Center,DTC,F18FFD
3146,42.827072,-75.546165,FSLH - Hamilton Dialysis Unit,HOSP-EC,C30B95
3147,43.122902,-76.136024,Heritage One Day Surgery,DTC,F18FFD
3148,40.879951,-73.880562,Montefiore Medical Center Henry and Lucy Moses Division Mobile Dental Van,,B0A150
3149,40.620693,-74.026825,New York Methodist Hospital Cardio-Vascular Services Extension Clinic,HOSP-EC,C30B95
3150,40.593884,-74.135338,Coney Island Hospital Mobile Extension Clinic,,B0A150
3151,40.766956,-73.953827,HSS Ambulatory Care Clinic,HOSP-EC,C30B95
3152,40.819061,-73.889282,Bella Vista Community Health Center,DTC-EC,7E7D72
3153,40.815807,-73.925629,Brightpoint Health,DTC-EC,7E7D72
3154,40.705261,-73.798347,The Firehouse Health Clinic,DTC-EC,7E7D72
3155,40.81908,-73.896103,ArchCare Senior Life at San Vicente de Paul Catholic Healthcare Center,DTC-EC,7E7D72
3156,40.732021,-73.954491,Manhattan Avenue Health Center,HOSP-EC,C30B95
3157,40.707573,-73.964531,Williamsburg Family Health Center,HOSP-EC,C30B95
3158,40.697224,-73.926102,LaProvidencia Family Health Center,HOSP-EC,C30B95
3159,40.821728,-73.891602,Adolescent Health and Wellness Center,DTC-EC,7E7D72
3160,42.941837,-78.834381,Sisters Central Park Diagnostic Center,HOSP-EC,C30B95
3161,44.744319,-75.127668,Madrid Health Center,HOSP-EC,C30B95
3162,42.100979,-75.916901,Bridgewater Center for Dialysis,DTC,F18FFD
3163,44.923668,-74.935875,Louisville Family Health Center,HOSP-EC,C30B95
3164,43.29562,-73.690735,West Mountain Health Services Buildings 1 and 2,DTC-EC,7E7D72
3165,40.820988,-73.901009,Center for Child Health & Resiliency,HOSP-EC,C30B95
3166,40.769276,-73.953278,HSS Physiatry & Pain Management,HOSP-EC,C30B95
3167,40.745899,-73.979996,NYU Hospital Center for Women's Imaging,HOSP-EC,C30B95
3168,40.726082,-73.991211,Project Renewal Inc Mobile Medical Van (Care Van),,B0A150
3169,40.725754,-73.790661,HSS Queens Outpatient Center,HOSP-EC,C30B95
3170,40.786766,-73.950356,"Carnegie Hill Endo, LLC",DTC,F18FFD
3171,40.746288,-73.971489,NYU Langone Medical Center Center for Musculoskeletal Care,HOSP-EC,C30B95
3172,40.740353,-73.949745,ICL HealthCare Choices in Long Island City,DTC-EC,7E7D72
3173,40.777412,-73.954582,NYU Langone Center for Women's Health,HOSP-EC,C30B95
3174,42.419167,-73.684418,Columbia Memorial Hospital Valatie Campus,HOSP-EC,C30B95
3175,43.032804,-74.343398,Johnstown Surgery Center,HOSP-EC,C30B95
3176,41.27494,-73.780914,Northern Westchester Hospital at Yorktown Imaging,HOSP-EC,C30B95
3177,41.105316,-74.032349,Hudson River Healthcare - Spring Valley,DTC-EC,7E7D72
3178,41.386158,-73.664238,Putnam Gastroenterology,DTC,F18FFD
3179,43.15921,-77.610031,Anthony Jordan Health Center at Andrews Terrace,DTC-EC,7E7D72
3180,41.117424,-74.050247,Refuah Health Twin,DTC-EC,7E7D72
3181,40.678535,-73.959801,Brooklyn Dialysis Center,DTC,F18FFD
3182,43.047562,-76.1436,UPSTATE C.A.R.E.,HOSP-EC,C30B95
3183,43.015381,-75.036514,Cooperative Magnetic Imaging Center,DTC-EC,7E7D72
3184,43.094315,-75.279503,Cooperative Magnetic Imaging Center,DTC-EC,7E7D72
3185,43.078629,-75.658684,Oneida Healthcare Imaging at OOS,HOSP-EC,C30B95
3186,43.314819,-76.405846,Fulton Medical Health Center,HOSP-EC,C30B95
3187,43.077267,-75.65197,Oneida Healthcare Sleep Center,HOSP-EC,C30B95
3188,43.049747,-75.380699,Bassett Healthcare - Clinton,HOSP-EC,C30B95
3189,42.100109,-75.905945,Lourdes Center for Mental Health,HOSP-EC,C30B95
3190,44.69302,-75.499672,CHMC - Ravinder Agarwal Renal Center,HOSP-EC,C30B95
3191,43.21064,-77.442009,Rochester Hearing and Speech Center - Webster Office,DTC-EC,7E7D72
3192,43.110699,-77.448196,St. John's Penfield Homes,NH,A887B8
3193,43.142666,-77.599258,Highland Family Medicine Extension,HOSP-EC,C30B95
3194,43.118511,-77.624039,Strong Women's Health Program,HOSP-EC,C30B95
3195,43.107254,-76.159653,Syracuse Surgery Center,DTC,F18FFD
3196,40.879951,-73.880562,Montefiore Medical Center Henry and Lucy Moses Division Mobile Dental Van #2,,B0A150
3197,40.747627,-73.974976,NYU Hospitals Center - Ambulatory Care Center,HOSP-EC,C30B95
3198,42.077095,-78.460129,Holiday Park Health Center,HOSP-EC,C30B95
3199,43.133602,-77.441673,Strong Eastside Orthopedics & Rehab Clinic,HOSP-EC,C30B95
3200,43.207592,-78.398091,United Memorial Medical Center Woman's Care Center,HOSP-EC,C30B95
3201,43.142353,-77.619461,Anthony Jordan Health Center at Kennedy Towers,DTC-EC,7E7D72
3202,43.175472,-77.644272,Anthony Jordan Health Center at Glenwood Gardens,DTC-EC,7E7D72
3203,43.15324,-79.029205,Mount St. Mary's Orthopedic Services,HOSP-EC,C30B95
3204,43.043762,-74.846054,Bassett Healthcare at Little Falls,HOSP-EC,C30B95
3205,43.157234,-77.606308,Downtown Dental Center,DTC-EC,7E7D72
3206,43.137878,-77.578552,Hillside Children's Center,DTC-EC,7E7D72
3207,43.112251,-77.616165,Developmentally Disabled Clinic at Monroe Community Hospital,DTC-EC,7E7D72
3208,43.112461,-77.607056,Strong Wound Center,HOSP-EC,C30B95
3209,43.098736,-77.763046,Unity Dialysis at Chili,HOSP-EC,C30B95
3210,43.046757,-76.136467,University Gastroenterology at the Philip G. Holtzapple Endoscopy Center,DTC,F18FFD
3211,43.229626,-76.300415,Phoenix Health Services Center,HOSP-EC,C30B95
3212,40.802967,-73.912178,Willow Avenue Family Residence,DTC-EC,7E7D72
3213,40.828342,-73.905624,Franklin Women's Shelter,DTC-EC,7E7D72
3214,43.015785,-78.782272,Menorah Campus Health Services,DTC,F18FFD
3215,40.824726,-73.891891,UHP Mobile Medical,,B0A150
3216,40.821575,-73.858223,Stevenson Family Health Center,DTC-EC,7E7D72
3217,40.706882,-73.811638,NYP/Queens Wound Healing Center,HOSP-EC,C30B95
3218,43.017967,-76.141777,Rahma Health Clinic,DTC,F18FFD
3219,40.805367,-73.913879,Jackson Avenue Family Residence,DTC-EC,7E7D72
3220,40.846775,-73.918961,Nelson Avenue Family Residence,DTC-EC,7E7D72
3221,40.786263,-73.929329,Wards Island Project,DTC-EC,7E7D72
3222,42.92717,-78.829224,Kaleida Health Women & Children's Hospital of Buffalo Women's OB/GYN Health Center,HOSP-EC,C30B95
3223,43.14917,-77.597397,Rochester General Imaging at Alexander Park,HOSP-EC,C30B95
3224,41.291515,-73.893532,Hudson Valley Center for Digestive Health,DTC,F18FFD
3225,41.11261,-74.130806,Renal Care of Suffern,DTC-EC,7E7D72
3226,40.801773,-73.943626,Family Health Center of Harlem,DTC-EC,7E7D72
3227,42.458614,-78.931793,Gowanda Urgent Care and Gowanda Medical Center,HOSP-EC,C30B95
3228,40.874603,-73.623009,North Shore/LIJ Imaging Center at Glen Cove,HOSP-EC,C30B95
3229,44.589157,-75.177544,UCPA of the North Country School-Based Portable Dental Equipment,,B0A150
3230,40.769203,-73.994598,West Side GI,DTC,F18FFD
3231,40.700286,-73.815895,Jamaica Hospital Sleep Center,HOSP-EC,C30B95
3232,43.046654,-77.093529,Clifton Springs Family Medicine,HOSP-EC,C30B95
3233,42.12817,-76.028564,UHS Primary Care Endwell,HOSP-EC,C30B95
3234,40.831406,-73.912041,Morrisania Dialysis Center,DTC-EC,7E7D72
3235,40.699696,-73.815239,Jamaica Hospital Mental Health Clinic,HOSP-EC,C30B95
3236,42.960804,-74.184807,Mohawk Valley Dialysis Center,DTC,F18FFD
3237,42.462021,-77.777122,Noyes Creekside Family Medicine,HOSP-EC,C30B95
3238,43.442978,-76.052109,Altmar-Parish-Williamstown Elementary School,,B0A150
3239,43.287125,-76.131012,Central Square Medical Health Center,HOSP-EC,C30B95
3240,42.0956,-75.967598,UHS Vestal,HOSP-EC,C30B95
3241,42.491486,-78.480171,Delevan Health Center,HOSP-EC,C30B95
3242,43.130727,-75.581211,Verona Health Center,HOSP-EC,C30B95
3243,41.244732,-73.684219,Putnam Hospital Center Outpatient Rehabilitation Services - Katonah Satellite,HOSP-EC,C30B95
3244,40.794212,-73.951065,Central Park Dialysis Center,DTC-EC,7E7D72
3245,42.805328,-73.917274,Ellis Cushing Medical Arts Building,HOSP-EC,C30B95
3246,43.060822,-77.098625,Friends for the Day,ADHCP,348D04
3247,43.241627,-78.165054,Orleans Community Health Center,,B0A150
3248,40.823139,-73.856194,Peninsula Community Health Center,DTC-EC,7E7D72
3249,43.060844,-76.093269,"Christian Health Service of Syracuse, Inc",DTC,F18FFD
3250,42.679839,-75.500144,Sherburne Adult Day Health Care Program,ADHCP,348D04
3251,41.193958,-73.879456,Phelps at Croton,HOSP-EC,C30B95
3252,40.641933,-74.077248,Margaret Sanger Center,DTC-EC,7E7D72
3253,42.853439,-73.775124,Ellis Hospital - Medical Center of Clifton Park,HOSP-EC,C30B95
3254,43.084652,-78.94072,Roswell Park Cancer Institute Niagara,HOSP-EC,C30B95
3255,41.291515,-73.893532,Hudson Valley Hospital Center Infusion Center,HOSP-EC,C30B95
3256,42.066044,-78.168999,"Jones Memorial Medical Practices, Bolivar",HOSP-EC,C30B95
3257,43.125015,-77.516937,Linden Medical Group,HOSP-EC,C30B95
3258,43.090973,-75.279434,Faxton-St. Luke's - Imaging Services,HOSP-EC,C30B95
3259,42.161896,-76.874283,Corning Hospital Same Day Surgery Center,HOSP-EC,C30B95
3260,41.926094,-73.994728,HealthAlliance Hospital Broadway Campus Physical Therapy,HOSP-EC,C30B95
3261,43.067722,-77.629646,Outpatient Oncology Clinic,HOSP-EC,C30B95
3262,42.665302,-73.768982,Koinonia Primary Care,DTC,F18FFD
3263,40.786949,-73.977875,Weill Cornell Imaging at NYP-West Side,DTC-EC,7E7D72
3264,43.169167,-78.692627,Community Health Center of Lockport,DTC-EC,7E7D72
3265,43.037491,-78.885834,River Road Primary Care Center,HOSP-EC,C30B95
3266,43.220142,-77.940994,Strong Brockport Clinic,HOSP-EC,C30B95
3267,42.076492,-73.954826,HealthAlliance Hosp Bdwy Campus Radiology and PT,HOSP-EC,C30B95
3268,43.205322,-77.600601,RGH ILS Hudson Center Medical Clinic,HOSP-EC,C30B95
3269,42.48444,-79.334892,The Chautauqua Center,DTC,F18FFD
3270,42.953724,-74.21608,St Mary's Amsterdam Urology,HOSP-EC,C30B95
3271,44.372658,-73.394829,Smith House Health Center,,B0A150
3272,40.811646,-73.509987,NSUH LIJ Imaging at Syosset,HOSP-EC,C30B95
